{
  "id": "9b7c1e2d3a4b5c6d7e8f90a1b2c3d4e5",
  "project_id": "proj_demo",
  "name": "support-agent run",
  "start_time": "2026-07-09T10:00:00.000Z",
  "end_time": "2026-07-09T10:00:05.000Z",
  "status": { "code": "ok" },
  "input": "help me reset my password",
  "output": "Sure — here are the steps...",
  "tags": ["prod", "support"],
  "environment": "production",
  "release": "app@1.4.0",
  "version": "route-v2",
  "session_id": "sess_abc",
  "user_id": "user_42",
  "attributes": { "http.route": "/agent" }
}
